{"arcs":[{"arc_id":"ARC-001-ce1b4924","justification":"Primary arc: establishes conformity as core narrative driver for premise \"In a village where time flows differently for each inhabitant, three clockmakers compete to build the one clock that will synchronize everyone, not knowing that unified time will erase the village's ability to dream.\"","progression":"Setup and escalation of conformity through sadness","scenes":[{"arc_id":"ARC-001-ce1b4924","beats":[{"action":"Establish societal conflict context","beat_id":"BEAT-SCN-01-001-857d86-001","information_revealed":["Key info for SCN-01-001-857d86 beat 1"],"information_withheld":[],"intention":"Establish stakes and context for the reader","pivot":false,"tension_delta":0},{"action":"Escalate tension through societal confrontation","beat_id":"BEAT-SCN-01-001-857d86-002","information_revealed":[],"information_withheld":[],"intention":"Raise tension through escalating action","pivot":false,"tension_delta":-1},{"action":"Character responds to societal pressure","beat_id":"BEAT-SCN-01-001-857d86-003","information_revealed":[],"information_withheld":[],"intention":"Show character response to pressure","pivot":false,"tension_delta":-1},{"action":"Revelation shifts understanding of Advance conformity — stage 1/4","beat_id":"BEAT-SCN-01-001-857d86-004","information_revealed":[],"information_withheld":[],"intention":"Reveal new information that changes dynamics","pivot":false,"tension_delta":1},{"action":"Consequence of societal conflict manifests","beat_id":"BEAT-SCN-01-001-857d86-005","information_revealed":[],"information_withheld":[],"intention":"Demonstrate consequences of prior actions","pivot":false,"tension_delta":-1},{"action":"Internal reaction to societal situation","beat_id":"BEAT-SCN-01-001-857d86-006","information_revealed":[],"information_withheld":[],"intention":"Deepen character through internal reaction","pivot":false,"tension_delta":0},{"action":"Pivot toward resolution of scene objective","beat_id":"BEAT-SCN-01-001-857d86-007","information_revealed":["Key info for SCN-01-001-857d86 beat 7"],"information_withheld":["Withheld from SCN-01-001-857d86 beat 7"],"intention":"Shift narrative toward scene resolution","pivot":true,"tension_delta":1},{"action":"Climactic beat: societal conflict peaks","beat_id":"BEAT-SCN-01-001-857d86-008","information_revealed":[],"information_withheld":[],"intention":"Deliver peak emotional impact","pivot":false,"tension_delta":1},{"action":"Establish societal conflict context","beat_id":"BEAT-SCN-01-001-857d86-009","information_revealed":[],"information_withheld":[],"intention":"Establish stakes and context for the reader","pivot":false,"tension_delta":0},{"action":"Escalate tension through societal confrontation","beat_id":"BEAT-SCN-01-001-857d86-010","information_revealed":[],"information_withheld":[],"intention":"Raise tension through escalating action","pivot":false,"tension_delta":1},{"action":"Character responds to societal pressure","beat_id":"BEAT-SCN-01-001-857d86-011","information_revealed":[],"information_withheld":["Withheld from SCN-01-001-857d86 beat 11"],"intention":"Show character response to pressure","pivot":false,"tension_delta":1}],"conflict":"Societal pressure challenges character regarding conformity","conflict_type":"societal","constraints":["Banned words: suddenly, literally, basically, very, really"],"emotion_intensity":0.4,"emotion_target":"joy","justification":"Scene 1 of arc \"conformity\": societal conflict advances narrative toward sadness","objective":"Advance conformity — stage 1/4","scene_id":"SCN-01-001-857d86","seeds_bloomed":[],"seeds_planted":["SEED-001-dd21a0"],"sensory_anchor":"Anchored to: The village of Horlogis exists in a temporal anomaly where each person experiences time at a different speed","subtext":{"character_thinks":"Internal struggle with societal conflict: Societal pressure challenges character regarding conformity","implied_emotion":"Suppressed joy beneath societal surface","reader_knows":"Reader awareness of: The village of Horlogis exists in a temporal anomaly where each person experiences time at a different speed","tension_type":"dramatic_irony"},"target_word_count":1250},{"arc_id":"ARC-001-ce1b4924","beats":[{"action":"Establish societal conflict context","beat_id":"BEAT-SCN-01-002-50de0e-001","information_revealed":["Key info for SCN-01-002-50de0e beat 1"],"information_withheld":[],"intention":"Establish stakes and context for the reader","pivot":false,"tension_delta":0},{"action":"Escalate tension through societal confrontation","beat_id":"BEAT-SCN-01-002-50de0e-002","information_revealed":[],"information_withheld":[],"intention":"Raise tension through escalating action","pivot":false,"tension_delta":-1},{"action":"Character responds to societal pressure","beat_id":"BEAT-SCN-01-002-50de0e-003","information_revealed":[],"information_withheld":[],"intention":"Show character response to pressure","pivot":false,"tension_delta":0},{"action":"Revelation shifts understanding of Advance conformity — stage 2/4","beat_id":"BEAT-SCN-01-002-50de0e-004","information_revealed":[],"information_withheld":[],"intention":"Reveal new information that changes dynamics","pivot":false,"tension_delta":0},{"action":"Consequence of societal conflict manifests","beat_id":"BEAT-SCN-01-002-50de0e-005","information_revealed":["Key info for SCN-01-002-50de0e beat 5"],"information_withheld":["Withheld from SCN-01-002-50de0e beat 5"],"intention":"Demonstrate consequences of prior actions","pivot":true,"tension_delta":1},{"action":"Internal reaction to societal situation","beat_id":"BEAT-SCN-01-002-50de0e-006","information_revealed":[],"information_withheld":[],"intention":"Deepen character through internal reaction","pivot":false,"tension_delta":1},{"action":"Pivot toward resolution of scene objective","beat_id":"BEAT-SCN-01-002-50de0e-007","information_revealed":[],"information_withheld":[],"intention":"Shift narrative toward scene resolution","pivot":false,"tension_delta":-1},{"action":"Climactic beat: societal conflict peaks","beat_id":"BEAT-SCN-01-002-50de0e-008","information_revealed":[],"information_withheld":["Withheld from SCN-01-002-50de0e beat 8"],"intention":"Deliver peak emotional impact","pivot":false,"tension_delta":1}],"conflict":"Societal pressure challenges character regarding conformity","conflict_type":"societal","constraints":["Banned words: suddenly, literally, basically, very, really"],"emotion_intensity":0.48,"emotion_target":"anticipation","justification":"Scene 2 of arc \"conformity\": societal conflict advances narrative toward sadness","objective":"Advance conformity — stage 2/4","scene_id":"SCN-01-002-50de0e","seeds_bloomed":["SEED-001-dd21a0"],"seeds_planted":["SEED-002-21a026"],"sensory_anchor":"Anchored to: Clockmaker Brice constructs mechanical clocks of absolute mathematical precision","subtext":{"character_thinks":"Internal struggle with societal conflict: Societal pressure challenges character regarding conformity","implied_emotion":"Suppressed anticipation beneath societal surface","reader_knows":"Reader awareness of: Clockmaker Abel builds clocks from bone and sinew that measure emotional time","tension_type":"dramatic_irony"},"target_word_count":1250},{"arc_id":"ARC-001-ce1b4924","beats":[{"action":"Establish existential conflict context","beat_id":"BEAT-SCN-01-003-243539-001","information_revealed":["Key info for SCN-01-003-243539 beat 1"],"information_withheld":[],"intention":"Establish stakes and context for the reader","pivot":false,"tension_delta":0},{"action":"Escalate tension through existential confrontation","beat_id":"BEAT-SCN-01-003-243539-002","information_revealed":[],"information_withheld":["Withheld from SCN-01-003-243539 beat 2"],"intention":"Raise tension through escalating action","pivot":false,"tension_delta":1}],"conflict":"Existential crisis forces reckoning with conformity","conflict_type":"existential","constraints":["Banned words: suddenly, literally, basically, very, really"],"emotion_intensity":0.63,"emotion_target":"anticipation","justification":"Scene 3 of arc \"conformity\": existential conflict advances narrative toward sadness","objective":"Advance conformity — stage 3/4","scene_id":"SCN-01-003-243539","seeds_bloomed":[],"seeds_planted":["SEED-003-a026d8"],"sensory_anchor":"Anchored to: The village council has decreed that one clock must be chosen by the solstice or trade with the outside world will cease","subtext":{"character_thinks":"Internal struggle with existential conflict: Existential crisis forces reckoning with conformity","implied_emotion":"Suppressed anticipation beneath existential surface","reader_knows":"Reader awareness of: Clockmaker Brice constructs mechanical clocks of absolute mathematical precision","tension_type":"hidden_motive"},"target_word_count":1250},{"arc_id":"ARC-001-ce1b4924","beats":[{"action":"Establish internal conflict context","beat_id":"BEAT-SCN-01-004-f6fdeb-001","information_revealed":["Key info for SCN-01-004-f6fdeb beat 1"],"information_withheld":[],"intention":"Establish stakes and context for the reader","pivot":false,"tension_delta":0},{"action":"Escalate tension through internal confrontation","beat_id":"BEAT-SCN-01-004-f6fdeb-002","information_revealed":[],"information_withheld":[],"intention":"Raise tension through escalating action","pivot":false,"tension_delta":0},{"action":"Character responds to internal pressure","beat_id":"BEAT-SCN-01-004-f6fdeb-003","information_revealed":[],"information_withheld":[],"intention":"Show character response to pressure","pivot":false,"tension_delta":0},{"action":"Revelation shifts understanding of Advance conformity — stage 4/4","beat_id":"BEAT-SCN-01-004-f6fdeb-004","information_revealed":[],"information_withheld":[],"intention":"Reveal new information that changes dynamics","pivot":false,"tension_delta":1},{"action":"Consequence of internal conflict manifests","beat_id":"BEAT-SCN-01-004-f6fdeb-005","information_revealed":[],"information_withhe